{
  "report_date": "2026-03-30",
  "total_trades_in_db": 110,
  "trade_count_analyzed": 57,
  "period_start": "2026-03-11",
  "period_end": "2026-03-26",
  "population_filter": {
    "name": "Population B",
    "rules": [
      "ticket >= 8",
      "open_time >= 2026-02-16",
      "close_time IS NOT NULL",
      "profit IS NOT NULL"
    ]
  },
  "insights": [
    {
      "category": "direction",
      "finding": "SELL: WR 60.5% (n=38)",
      "sample_size": 38,
      "confidence_level": "HIGH_CONFIDENCE"
    },
    {
      "category": "direction",
      "finding": "BUY: WR 36.8% (n=19)",
      "sample_size": 19,
      "confidence_level": "MEDIUM_CONFIDENCE"
    },
    {
      "category": "session",
      "finding": "NewYork: WR 50.0% (n=22)",
      "sample_size": 22,
      "confidence_level": "HIGH_CONFIDENCE"
    },
    {
      "category": "session",
      "finding": "London: WR 47.1% (n=17)",
      "sample_size": 17,
      "confidence_level": "MEDIUM_CONFIDENCE"
    },
    {
      "category": "session",
      "finding": "Asia: WR 60.0% (n=15)",
      "sample_size": 15,
      "confidence_level": "MEDIUM_CONFIDENCE"
    },
    {
      "category": "session",
      "finding": "OffHours: WR 66.7% (n=3)",
      "sample_size": 3,
      "confidence_level": "LOW_CONFIDENCE"
    },
    {
      "category": "close_reason",
      "finding": "Stop Loss: WR 61.3% (n=31)",
      "sample_size": 31,
      "confidence_level": "HIGH_CONFIDENCE"
    },
    {
      "category": "close_reason",
      "finding": "Expert Advisor: WR 27.8% (n=18)",
      "sample_size": 18,
      "confidence_level": "MEDIUM_CONFIDENCE"
    },
    {
      "category": "close_reason",
      "finding": "Take Profit: WR 100.0% (n=4)",
      "sample_size": 4,
      "confidence_level": "LOW_CONFIDENCE"
    },
    {
      "category": "close_reason",
      "finding": "Other (1): WR 66.7% (n=3)",
      "sample_size": 3,
      "confidence_level": "LOW_CONFIDENCE"
    },
    {
      "category": "close_reason",
      "finding": "Manual/Bot: WR 0.0% (n=1)",
      "sample_size": 1,
      "confidence_level": "LOW_CONFIDENCE"
    },
    {
      "category": "direction",
      "finding": "SELL dominance confirmed: WR 60.5% vs BUY WR 36.8%. The core edge of this agent is currently short-side only.",
      "sample_size": 38,
      "confidence_level": "HIGH_CONFIDENCE"
    },
    {
      "category": "behavioral",
      "finding": "Systemic execution failure: 27 trades show 0.0 minute duration with identical open/close timestamps. This suggests technical latency or invalid price-action handling.",
      "sample_size": 27,
      "confidence_level": "HIGH_CONFIDENCE"
    },
    {
      "category": "close_reason",
      "finding": "Logic-based exits are toxic: 'Expert Advisor' triggered exits result in a 27.8% win rate, significantly underperforming the mechanical 'Stop Loss' (trailing) WR of 61.3%.",
      "sample_size": 18,
      "confidence_level": "MEDIUM_CONFIDENCE"
    },
    {
      "category": "session",
      "finding": "London session performance is lagging: WR 47.1% compared to Asia (60%) and New York (50%).",
      "sample_size": 17,
      "confidence_level": "MEDIUM_CONFIDENCE"
    },
    {
      "category": "direction",
      "finding": "BUY setups are currently high-risk: 36.8% WR is well below the population average of 52.6%.",
      "sample_size": 19,
      "confidence_level": "MEDIUM_CONFIDENCE"
    }
  ],
  "recommendations": [
    "[HIGH] Prioritize SELL entries over BUY — SELL WR 60.5% (n=38) demonstrates a stable edge, while BUY WR 36.8% (n=19) is sub-optimal.",
    "[HIGH] Resolve zero-duration trade anomaly immediately. 27 trades (tickets 1533338040 to 1557975470) closed instantly, causing unnecessary slippage and fee exposure.",
    "[MEDIUM] Audit 'Expert Advisor' exit logic. WR of 27.8% (n=18) suggests the current algorithm is cutting trades at the wrong time or reacting to noise rather than trend exhaustion.",
    "[MEDIUM] Tighten BUY entry filters. WR 36.8% (n=19) indicates the current long-side criteria are catching falling knives or failing to account for XAU/USD bearish momentum.",
    "[MEDIUM] Monitor London session performance. Current WR 47.1% (n=17) is below the profitability threshold. Flag for reduction if WR remains below 50% after reaching n=20."
  ],
  "metadata": {
    "model": "gemini-3-flash-preview",
    "tokens": {
      "input": 16461,
      "output": 2440,
      "total": 18901
    },
    "latency_ms": 15799
  }
}